prob,frex,lift,score,topic,n,label
sdms ecoregion elith metric ecographi bioclimat peterson,sdms guisan elith thuiller ensembl ecographi araújo,bombina hypervolum pinguicula acatus accuclim africlim ahcv,sdms elith guisan thuiller bioclimat ecoregion ecographi,1,511,Species distribution modelling
scientist infrastructur metadata engag collabor educ volunt,engag metadata ontolog crowdsourc semant workflow interoper,abelicea acsa agisoft altmetr anguag annosi apsv,semant irmng koala finbif crowdsourc ǀžŝě interoper,6,395,Ecoinformatics
tail butterfli reptil lizard wetland mainland snake,quoll glider litoria koel antechinus synemon pectorali,cboc cryptozoolog euploea latisternum mcallan pelsaert rebeira,quoll koel synemon monarch honeyeat arkto glider,4,313,Zoology
phytologist proven canopi hydraul plastic stomat woodi,hydraul stomat vcmax resprout mycorrhiz pannosa turgor,anet anisohydri apsteinii arabicum arthraxon basist beebox,vcmax stomat pannosa xylem resprout ψtlp hydraul,9,277,Plant physiology
loci allel haplotyp marker reconstruct nuclear bayesian,raxml coptoterm carolinianum snps allel haplotyp polyploid,acin acystopteri amiterm bamm bammtool bandelt bayarealik,allel haplotyp coptoterm carolinianum snps mtdna brownea,10,227,Genetics
virus infect exot cultiv moth vector pathogen,climex psidii puccinia nassella ddrp monilinia fructicola,anthriscus boncuklu clso ddrp diuraphi dominiak ebneri,ddrp climex psidii monilinia swine fructicola nassella,3,218,Invasive species
spong fisheri sgrdl antarct shell shallow benthic,spong sgrdl seagrass kelp nimb manta undaria,afma agela agelasida alexandrium alongi amphiboli amphidrom,sgrdl nimb unlocalis spong naracoopa subtid tmag,5,190,Marine ecology
glabrous crisp hair ﬂower daviesia bract phyllod,dracophyllum lado seringia involucr preceed hydriastel tepal,adenogyna adenolasia androecium arequipa ascomata brachypetala brevialata,lado dracophyllum glabrous hydriastel seringia bract daviesia,8,152,Botany
bee honey chemic edna compound venom metabarcod,biodiesel trypanosom cannabi ensm envenom venom diesel,acartia aceton bilocularin cestod chromen codonellopsi demersus,biodiesel trypanosom metabarcod diabet fluoroacet ensm edna,2,150,Biochemistry
ventral holotyp anic zootaxa segment gall distal,pronotum lepanus elytra sclerit prolater antenn retrolater,urophonius actilasioptera acutissimus afﬁlastro aglaotilla agrotera alepida,pediobius chaetig naranjakotta lepanus tibia paramer pronotum,7,126,Taxonomy